{
  "schema": "scds-uncertainty-register/1.0",
  "version": "2.4.0",
  "uncertainty_register_id": "uncertainty-register-2dbce25bcebd5fa1",
  "decision_id": "SCDS-V240-SAMPLE",
  "created_at": "2026-09-12T04:19:02.447862Z",
  "updated_at": "2026-09-12T04:19:02.447862Z",
  "uncertainties": [
    {
      "uncertainty_id": "u-a-cost",
      "target_type": "evaluation",
      "target_id": "ev-a-cost",
      "parameter": "value",
      "label": "Option A lifecycle cost range",
      "method": "range",
      "baseline": 47.5,
      "lower": 35.0,
      "upper": 60.0,
      "unit": "index",
      "distribution": {},
      "confidence_level": null,
      "source_refs": [
        "src-cost"
      ],
      "rationale": "",
      "review_status": "reviewed",
      "valid_bounds": true,
      "target_known": true,
      "provenance": {},
      "content_fingerprint": "120206a9fb05db9fc342305941676952f9943f8f11f58a74feacdbcb7e2139c2",
      "raw": {
        "uncertainty_id": "u-a-cost",
        "target_type": "evaluation",
        "target_id": "ev-a-cost",
        "parameter": "value",
        "label": "Option A lifecycle cost range",
        "lower": 35,
        "upper": 60,
        "unit": "index",
        "review_status": "reviewed",
        "source_refs": [
          "src-cost"
        ]
      }
    },
    {
      "uncertainty_id": "u-a-impact",
      "target_type": "evaluation",
      "target_id": "ev-a-impact",
      "parameter": "value",
      "label": "Option A impact range",
      "method": "range",
      "baseline": 7.5,
      "lower": 6.0,
      "upper": 9.0,
      "unit": "index",
      "distribution": {},
      "confidence_level": null,
      "source_refs": [
        "src-impact"
      ],
      "rationale": "",
      "review_status": "reviewed",
      "valid_bounds": true,
      "target_known": true,
      "provenance": {},
      "content_fingerprint": "4cbe0ede616f0613f4ab6dc4225ca159be3c40e7266f1c8d272202c5717950b1",
      "raw": {
        "uncertainty_id": "u-a-impact",
        "target_type": "evaluation",
        "target_id": "ev-a-impact",
        "parameter": "value",
        "label": "Option A impact range",
        "lower": 6,
        "upper": 9,
        "unit": "index",
        "review_status": "reviewed",
        "source_refs": [
          "src-impact"
        ]
      }
    }
  ],
  "diagnostics": {
    "record_count": 2,
    "bounded_count": 2,
    "reviewed_count": 2,
    "invalid_bound_ids": [],
    "unknown_target_ids": [],
    "characterization_coverage_percent": 100.0
  },
  "provenance": {
    "created_by": "decision-studio",
    "records": []
  },
  "boundary": "Uncertainty records describe bounded assumptions and input variability. They do not convert uncertainty into certainty or certify a decision outcome."
}
